[
  {
    "id": "c_demo_001",
    "subject": "DemoWidget",
    "predicate": "has_public_release_year",
    "object": "2026",
    "claim_type": "SourceFact",
    "source_id": "sample_demo",
    "evidence_span": "public release year is 2026",
    "status": "supported",
    "entity_ids": ["ent_demowidget"],
    "notes": null
  },
  {
    "id": "c_demo_002",
    "subject": "DemoWidget",
    "predicate": "manual_states_standby_power",
    "object": "under 0.5W when plugged in but powered off",
    "claim_type": "SourceFact",
    "source_id": "sample_demo",
    "evidence_span": "standby power is under 0.5W when the device is plugged in but powered off",
    "status": "supported",
    "entity_ids": ["ent_demowidget"],
    "notes": null
  },
  {
    "id": "c_demo_003",
    "subject": "DemoWidget",
    "predicate": "manual_states_typical_active_power",
    "object": "up to 12W during normal use",
    "claim_type": "SourceFact",
    "source_id": "sample_demo",
    "evidence_span": "typical active power draw up to 12W during normal use",
    "status": "supported",
    "entity_ids": ["ent_demowidget"],
    "notes": null
  },
  {
    "id": "c_sun_2024_001",
    "subject": "DC Voltage Prediction based on CNN with Physics Information Embedding for MVDC Distribution Systems",
    "predicate": "proposes",
    "object": "a physics-embedded convolutional neural network (PECNN) for terminal dc voltage estimation in MVDC distribution systems",
    "claim_type": "SourceFact",
    "source_id": "sun_2024_dc_voltage_prediction_mvdc",
    "evidence_span": "This paper proposes a novel physics-embedded CNN (PECNN), specifically designed for terminal dc voltage estimation in MVDC distribution systems with different converter control schemes.",
    "status": "supported",
    "entity_ids": ["ent_sun_2024_dc_voltage_prediction_mvdc"],
    "notes": null
  },
  {
    "id": "c_sun_2024_002",
    "subject": "PECNN",
    "predicate": "is_enhanced_with",
    "object": "a multi-channel combination layer and a physics operation layer",
    "claim_type": "SourceFact",
    "source_id": "sun_2024_dc_voltage_prediction_mvdc",
    "evidence_span": "The PECNN is enhanced with two additional layers, including a multi-channel combination layer and a physics operation layer.",
    "status": "supported",
    "entity_ids": ["ent_sun_2024_dc_voltage_prediction_mvdc"],
    "notes": null
  },
  {
    "id": "c_sun_2024_003",
    "subject": "PECNN evaluation",
    "predicate": "uses",
    "object": "three MVDC distribution networks with different dc voltage levels and network layouts",
    "claim_type": "SourceFact",
    "source_id": "sun_2024_dc_voltage_prediction_mvdc",
    "evidence_span": "Three MVDC distribution networks with different dc voltage levels and network layouts are used to verify the superiority of proposed PECNN compared to other NNs in different topologies.",
    "status": "supported",
    "entity_ids": ["ent_sun_2024_dc_voltage_prediction_mvdc"],
    "notes": null
  },
  {
    "id": "c_sun_2024_004",
    "subject": "PECNN",
    "predicate": "embeds",
    "object": "the physical relation between voltage, current, and conductance in an MVDC network by reconstructing input voltage and current matrices",
    "claim_type": "SourceFact",
    "source_id": "sun_2024_dc_voltage_prediction_mvdc",
    "evidence_span": "the intrinsic physical relation between voltage, current, and conductance in an MVDC network is embedded by reconstructing the input voltage and current matrices",
    "status": "supported",
    "entity_ids": ["ent_sun_2024_dc_voltage_prediction_mvdc"],
    "notes": null
  },
  {
    "id": "c_kong_2024_001",
    "subject": "A Physics-informed Neural Network Method for LC Parameter Estimation in Three-Phase Inverter",
    "predicate": "proposes",
    "object": "a parameter estimation method based on the combined use of artificial neural networks and circuit analytical models",
    "claim_type": "SourceFact",
    "source_id": "kong_2024_pinn_lc_parameter_estimation",
    "evidence_span": "This paper proposes a parameter estimation method based on the combination use of artificial neural network and circuit analytical models, e.g., physics-informed neural network (PINN), for a three-phase inverter application.",
    "status": "supported",
    "entity_ids": ["ent_kong_2024_pinn_lc_parameter_estimation"],
    "notes": null
  },
  {
    "id": "c_kong_2024_002",
    "subject": "PINN parameter estimation method",
    "predicate": "estimates",
    "object": "DC-link capacitance and AC-side inductance parameters for a three-phase inverter",
    "claim_type": "SourceFact",
    "source_id": "kong_2024_pinn_lc_parameter_estimation",
    "evidence_span": "The DC-link capacitance and the AC-side inductance parameters can be used as feedback for control optimization and component degradation monitoring.",
    "status": "supported",
    "entity_ids": ["ent_kong_2024_pinn_lc_parameter_estimation"],
    "notes": null
  },
  {
    "id": "c_kong_2024_003",
    "subject": "PINN parameter estimation method",
    "predicate": "does_not_require",
    "object": "additional hardware circuitry",
    "claim_type": "SourceFact",
    "source_id": "kong_2024_pinn_lc_parameter_estimation",
    "evidence_span": "It does not require any additional hardware circuitry and can be well-trained based on a small training dataset.",
    "status": "supported",
    "entity_ids": ["ent_kong_2024_pinn_lc_parameter_estimation"],
    "notes": null
  },
  {
    "id": "c_kong_2024_004",
    "subject": "three-phase inverter case study",
    "predicate": "is_validated_with",
    "object": "theoretical analyses, simulations, and experimental verifications",
    "claim_type": "SourceFact",
    "source_id": "kong_2024_pinn_lc_parameter_estimation",
    "evidence_span": "A three-phase inverter case study is presented with theoretical analyses, simulations, and experimental verifications.",
    "status": "supported",
    "entity_ids": ["ent_kong_2024_pinn_lc_parameter_estimation"],
    "notes": null
  },
  {
    "id": "c_kong_2024_005",
    "subject": "experimental test",
    "predicate": "shows_maximum_error",
    "object": "5.2% for DC-link capacitance and 14.7% for AC-side inductance",
    "claim_type": "SourceFact",
    "source_id": "kong_2024_pinn_lc_parameter_estimation",
    "evidence_span": "Based on the experimental test it shows a maximum error of 5.2% and 14.7% for the DC-link capacitance and AC-side inductance, respectively.",
    "status": "supported",
    "entity_ids": ["ent_kong_2024_pinn_lc_parameter_estimation"],
    "notes": null
  }
]
